{
  "schemaVersion": "sprint3-acceptance-assets.v1",
  "evidenceBoundary": {"currentEvidenceLevel": "E1", "allowedExecutionModes": ["planned", "fixture", "local"], "connected": false, "liveRuntime": false, "productionIdentity": false, "claim": "acceptance-assets-only"},
  "scenarios": [
    {
      "id": "oj-real-e4", "userValue": "A student submits deterministic C++17 work and receives an authoritative evaluation readback.",
      "currentEvidenceLevel": "E1", "executionMode": "fixture", "providerMode": "mock", "isFixture": true, "isMock": true, "futureLiveE4Required": true,
      "productEntrypoint": "student submission UI and versioned product API", "actor": "student", "tenantCourseIdentity": "required-at-live-e4",
      "authenticationIdentity": "required-at-live-e4", "authorizationIdentity": "required-at-live-e4", "submissionIdentity": "required-at-live-e4",
      "labReleaseIdentity": "required-at-live-e4", "evaluationReleaseIdentity": "required-at-live-e4", "environmentTemplateReleaseIdentity": "required-at-live-e4",
      "imageDigest": "required-at-live-e4", "specHash": "required-at-live-e4", "artifactHash": "required-at-live-e4", "runId": "required-at-live-e4", "stepRunId": "required-at-live-e4", "attemptId": "required-at-live-e4", "resourceIdentity": "required-at-live-e4", "accessIdentity": "required-at-live-e4", "traceId": "required-at-live-e4",
      "preconditions": ["approved immutable releases", "authenticated course membership", "real OJ provider binding"],
      "actions": ["submit correct sample", "submit five negative samples", "read back case facts and deterministic aggregate"],
      "expectedTransitions": ["submission frozen", "run queued-running-terminal", "readback binds the same run identity"],
      "expectedDiagnostics": ["LW_ACCEPTANCE_E4_PASS", "sample-specific stable diagnostics"],
      "expectedEvidence": ["case facts without evaluator-owned total score", "release and digest identity", "replay and idempotency proof"],
      "failureEvidence": ["typed diagnostic", "no publishable score or partial state", "safe bounded logs"],
      "cleanup": ["remove run-scoped resources", "verify no residual workload"],
      "rollback": ["withdraw release blocks new runs", "started run remains bound to immutable release"],
      "e4SuccessConditions": ["real product path", "all six samples classified", "same identity from write through readback", "cleanup verified"]
    },
    {
      "id": "container-linux-clone-real-e4", "userValue": "A student receives and uses an authorized real container clone without a fixture fallback.",
      "currentEvidenceLevel": "E1", "executionMode": "fixture", "providerMode": "mock", "isFixture": true, "isMock": true, "futureLiveE4Required": true,
      "productEntrypoint": "student environment UI and versioned product API", "actor": "student", "tenantCourseIdentity": "required-at-live-e4",
      "authenticationIdentity": "required-at-live-e4", "authorizationIdentity": "required-at-live-e4", "submissionIdentity": "required-at-live-e4",
      "labReleaseIdentity": "required-at-live-e4", "evaluationReleaseIdentity": "required-at-live-e4", "environmentTemplateReleaseIdentity": "required-at-live-e4",
      "imageDigest": "required-at-live-e4", "specHash": "required-at-live-e4", "artifactHash": "required-at-live-e4", "runId": "required-at-live-e4", "stepRunId": "required-at-live-e4", "attemptId": "required-at-live-e4", "resourceIdentity": "required-at-live-e4", "accessIdentity": "required-at-live-e4", "traceId": "required-at-live-e4",
      "preconditions": ["approved digest-only container release", "authenticated course membership", "real Environment Resource and Access providers"],
      "actions": ["request clone", "wait for authoritative readiness", "use authorized endpoint", "submit extracted artifact"],
      "expectedTransitions": ["environment provisioning-ready", "AccessGrant active-revoked", "evaluation input bound to clone"],
      "expectedDiagnostics": ["LW_ACCEPTANCE_E4_PASS", "provider and access outage diagnostics"],
      "expectedEvidence": ["clone provider and image digest", "Resource Lease and AccessGrant identity", "release-bound evaluation input"],
      "failureEvidence": ["provider outage fails closed", "expired access creates no connection", "withdrawn release creates no new clone"],
      "cleanup": ["delete run-scoped clone", "revoke access", "verify no residual resource"],
      "rollback": ["withdraw release blocks new clones", "existing identity remains auditable"],
      "e4SuccessConditions": ["real container clone", "real Resource and Access", "no local fake container", "cleanup verified"]
    },
    {
      "id": "kubevirt-linux-clone-real-e4", "userValue": "A student receives and uses an authorized real KubeVirt VM clone through the product path.",
      "currentEvidenceLevel": "E1", "executionMode": "fixture", "providerMode": "mock", "isFixture": true, "isMock": true, "futureLiveE4Required": true,
      "productEntrypoint": "student environment UI and versioned product API", "actor": "student", "tenantCourseIdentity": "required-at-live-e4",
      "authenticationIdentity": "required-at-live-e4", "authorizationIdentity": "required-at-live-e4", "submissionIdentity": "required-at-live-e4",
      "labReleaseIdentity": "required-at-live-e4", "evaluationReleaseIdentity": "required-at-live-e4", "environmentTemplateReleaseIdentity": "required-at-live-e4",
      "imageDigest": "required-at-live-e4", "specHash": "required-at-live-e4", "artifactHash": "required-at-live-e4", "runId": "required-at-live-e4", "stepRunId": "required-at-live-e4", "attemptId": "required-at-live-e4", "resourceIdentity": "required-at-live-e4", "accessIdentity": "required-at-live-e4", "traceId": "required-at-live-e4",
      "preconditions": ["approved VM release and disk identity", "hardware KVM readiness", "real KubeVirt Resource and Access providers"],
      "actions": ["request VM clone", "wait for VM readiness", "connect through approved SSH entrypoint", "submit extracted artifact"],
      "expectedTransitions": ["VM clone provisioning-ready", "AccessGrant active-expired", "evaluation input bound to VM"],
      "expectedDiagnostics": ["LW_ACCEPTANCE_E4_PASS", "KubeVirt Resource and Access failure diagnostics"],
      "expectedEvidence": ["VM UID disk identity and provider revision", "real Resource Lease and AccessGrant", "revoke and expiry readback"],
      "failureEvidence": ["no container fallback", "provider outage fails closed", "revoked access creates no connection"],
      "cleanup": ["delete run-scoped VM and disk", "revoke access", "verify no residual resource"],
      "rollback": ["withdraw release blocks new VM clones", "existing VM identity remains auditable"],
      "e4SuccessConditions": ["real KubeVirt clone", "real Resource and Access", "formal access entrypoint", "cleanup verified"]
    }
  ],
  "samples": [
    {"id":"oj-correct","kind":"correct","path":"correct.cpp","sha256":"e625317fca4e13b728619e4a453874302747e4f097db9abec093e67b592e92c3","language":"c++17","expectedTerminalState":"Accepted","expectedDiagnostic":null,"inputPath":"input.txt","inputSha256":"337b794ce718a09a620090d53541c3b4640a64133bbee2188444810cd3169f81","expectedOutputPath":"expected.txt","expectedOutputSha256":"f0b5c2c2211c8d67ed15e75e656c7862d086e9245420892a7de62cd9ec582a06","staticValidationOnly":true,"deterministic":true,"networkAllowed":false,"filesystemAllowed":false,"safeToExecuteOnHost":false,"limits":{"compileWallMs":10000,"runWallMs":1000,"cpuMs":500,"memoryBytes":33554432,"outputBytes":1024},"evidenceBoundary":"static-asset-only-not-executed"},
    {"id":"oj-compile-error","kind":"compile-error","path":"compile_error.cpp","sha256":"e68de536460f5678a5307b9cfb62d9fde87abb033834ae0852dc5af1e11a8ea9","language":"c++17","expectedTerminalState":"CompileError","expectedDiagnostic":"LW_OJ_COMPILE_ERROR","staticValidationOnly":true,"deterministic":true,"networkAllowed":false,"filesystemAllowed":false,"safeToExecuteOnHost":false,"limits":{"compileWallMs":10000,"runWallMs":1000,"cpuMs":500,"memoryBytes":33554432,"outputBytes":1024},"evidenceBoundary":"static-asset-only-not-executed"},
    {"id":"oj-wrong-answer","kind":"wrong-answer","path":"wrong_answer.cpp","sha256":"559022590750a34c5fd1bae742b25cb057a5d80159f28d4d29d1e4f4b27be3e4","language":"c++17","expectedTerminalState":"WrongAnswer","expectedDiagnostic":"LW_OJ_WRONG_ANSWER","inputPath":"input.txt","inputSha256":"337b794ce718a09a620090d53541c3b4640a64133bbee2188444810cd3169f81","expectedOutputPath":"expected.txt","expectedOutputSha256":"f0b5c2c2211c8d67ed15e75e656c7862d086e9245420892a7de62cd9ec582a06","actualOutputPath":"wrong-actual.txt","actualOutputSha256":"ee3aa64bb94a50845d5024cd4bd20202a4567aed5cd5328c0d97e9920775fc28","staticValidationOnly":true,"deterministic":true,"networkAllowed":false,"filesystemAllowed":false,"safeToExecuteOnHost":false,"limits":{"compileWallMs":10000,"runWallMs":1000,"cpuMs":500,"memoryBytes":33554432,"outputBytes":1024},"evidenceBoundary":"static-asset-only-not-executed"},
    {"id":"oj-time-limit","kind":"time-limit","path":"time_limit.cpp","sha256":"df7ce4fdf0b81ea70100f5267ed12634fa26f756f140fae44ad7148cbf2b2ad2","language":"c++17","expectedTerminalState":"TimeLimitExceeded","expectedDiagnostic":"LW_OJ_TIME_LIMIT","staticValidationOnly":true,"deterministic":true,"networkAllowed":false,"filesystemAllowed":false,"safeToExecuteOnHost":false,"limits":{"compileWallMs":10000,"runWallMs":250,"cpuMs":200,"memoryBytes":33554432,"outputBytes":1024},"evidenceBoundary":"static-asset-only-not-executed"},